<?xml version="1.0" encoding="UTF-8" ?>

<computers xmlns="https://www.w3schools.com" xmlns:xsd="http://www.w3.org/2001/XMLSchema-instance" xsd:schemaLocation="computer.xsd">
	<computer>
		<model>ASUS K501</model>
		<cpu brand="Intel">6500U</cpu>
		<gpu brand="Intel">HD520</gpu>
		<gpu brand="Nvidia">GTX 950M</gpu>
		<ram>12</ram>
		<hdd brand="HGST">1024</hdd>
	</computer>
	<computer>
		<model>Packard Bell XYZ</model>
		<cpu brand="Intel">7500U</cpu>
		<gpu brand="Intel">HD540</gpu>
		<ram>16</ram>
		<ssd brand="Samsung">256</ssd>
		<hdd brand="HGST">1024</hdd>
		<hdd brand="WD">1024</hdd>
		<hdd brand="Saegate">2048</hdd>
	</computer>
</computers>
